<?xml version="1.0" encoding="UTF-8"?>
<DeviceDescription xmlns="../ns_description" xmlns:xsi="http://www.w3.org/2001/XMLSchema-instance" xsi:schemaLocation="../ns_description
	../../../device_description.xsd">
	<ManufacturerInfo Manufacturer="Martin" Model="Mac 600 NT" Firmware="" Mode="4"/>
	<PhysicalProperties Type="YokeWash">
		<Weight>
			<Unit>kg</Unit>
			<Value>31.5</Value>
		</Weight>
		<Geometry>
			<Width>
				<Unit>mm</Unit>
				<Value>481</Value>
			</Width>
			<Depth>
				<Unit>mm</Unit>
				<Value>356</Value>
			</Depth>
			<Height>
				<Unit>mm</Unit>
				<Value>579</Value>
			</Height>
		</Geometry>
		<Lamp>
			<Type>MSD</Type>
			<Model>philips MSD 575  575W 75 lm/W</Model>
			<Power>750</Power>
			<ColorTemp>6000</ColorTemp>
		</Lamp>
	</PhysicalProperties>
	<ChannelDefinition Align="15">
		<Channel ChannelNo="1" Name="Shutter" Semantic="Shutter" Category="Beam" DefaultValue="20" HighlightValue="20"/>
		<Channel ChannelNo="2" Name="Intensity1" Semantic="Dimmer" Category="Intensity" DefaultValue="0" HighlightValue="255"/>
		<Channel ChannelNo="3" Name="Cyan" Semantic="Cyan" Category="Colour" DefaultValue="0" HighlightValue="0"/>
		<Channel ChannelNo="4" Name="Magenta" Semantic="Magenta" Category="Colour" DefaultValue="0" HighlightValue="0"/>
		<Channel ChannelNo="5" Name="Yellow" Semantic="Yellow" Category="Colour" DefaultValue="0" HighlightValue="0"/>
		<Channel ChannelNo="6" Name="CTO" Semantic="CTO" Category="Colour" DefaultValue="0" HighlightValue="0"/>
		<Channel ChannelNo="7" Name="Colour1" Semantic="Colour" Category="Colour" DefaultValue="0" HighlightValue="0"/>
		<Channel ChannelNo="8" Name="BeamAngle" Semantic="Beam Shaper" Category="Beam" DefaultValue="0" HighlightValue="0"/>
		<Channel ChannelNo="9" Name="Frost" Semantic="Frost" Category="Beam" DefaultValue="0" HighlightValue="0"/>
		<Channel ChannelNo="10" Name="Pan" Semantic="Pan Coarse" Category="Position" BitRes="16" DefaultValue="127" ByteNo="1"/>
		<Channel ChannelNo="11" Name="PanFine" Semantic="Pan Fine" Category="Position" BitRes="16" DefaultValue="0" ByteNo="0" MasterChannelNo="10"/>
		<Channel ChannelNo="12" Name="Tilt" Semantic="Tilt Coarse" Category="Position" BitRes="16" DefaultValue="127" ByteNo="1"/>
		<Channel ChannelNo="13" Name="TiltFine" Semantic="Tilt Fine" Category="Position" BitRes="16" DefaultValue="0" ByteNo="0" MasterChannelNo="12"/>
		<Channel ChannelNo="14" Name="PanTiltSpeed" Semantic="Pan Tilt Speed" Category="Control" DefaultValue="0"/>
		<Channel ChannelNo="15" Name="MSpeed" Semantic="Effects Speed" Category="Control" DefaultValue="0"/>
	</ChannelDefinition>
	<DependencyDeclaration/>
	<ParameterDefinition/>
</DeviceDescription>
