<?xml version="1.0" encoding="UTF-8"?>
<!-- edited with XMLSpy v2010 (http://www.altova.com) by test (test) -->
<DeviceDescription xmlns="../ns_description" xmlns:xsi="http://www.w3.org/2001/XMLSchema-instance" xsi:schemaLocation="../ns_description
	../../../device_description.xsd">
	<ManufacturerInfo Manufacturer="Robe" Model="ColorBeam 700E AT" Firmware="1.1" Mode="4"/>
	<PhysicalProperties Type="YokeSpot">
		<Weight>
			<Unit>kg</Unit>
			<Value>0</Value>
		</Weight>
		<Geometry>
			<Width>
				<Unit>mm</Unit>
				<Value>0</Value>
			</Width>
			<Depth>
				<Unit>mm</Unit>
				<Value>0</Value>
			</Depth>
			<Height>
				<Unit>mm</Unit>
				<Value>0</Value>
			</Height>
		</Geometry>
	</PhysicalProperties>
	<ChannelDefinition Align="23">
		<Channel ChannelNo="1" Name="Pan" Semantic="Pan" Category="Position" BitRes="16" ByteNo="1" DefaultValue="128"/>
		<Channel ChannelNo="2" Name="PanFine" Semantic="Pan Fine" Category="Position" BitRes="16" ByteNo="0" MasterChannelNo="1" DefaultValue="128"/>
		<Channel ChannelNo="3" Name="Tilt" Semantic="Tilt" Category="Position" BitRes="16" ByteNo="1" DefaultValue="128"/>
		<Channel ChannelNo="4" Name="TiltFine" Semantic="Tilt Fine" Category="Position" BitRes="16" ByteNo="0" MasterChannelNo="3" DefaultValue="128"/>
		<Channel ChannelNo="5" Name="PanTiltSpeed" Semantic="Pan/Tilt Speed" Category="Control"/>
		<Channel ChannelNo="6" Name="Control" Semantic="Power / Functions" Category="Control"/>
		<Channel ChannelNo="7" Name="Colour1" Semantic="Colour Wheel" Category="Colour" HighlightValue="0"/>
		<Channel ChannelNo="8" Name="Cyan" Semantic="Cyan" Category="Colour" HighlightValue="0"/>
		<Channel ChannelNo="9" Name="Magenta" Semantic="Magenta" Category="Colour" HighlightValue="0"/>
		<Channel ChannelNo="10" Name="Yellow" Semantic="Yellow" Category="Colour" HighlightValue="0"/>
		<Channel ChannelNo="11" Name="CTO" Semantic="CTO" Category="Colour" HighlightValue="0"/>
		<Channel ChannelNo="12" Name="MacroColour" Semantic="CMY Macros" Category="Colour" HighlightValue="0"/>
		<Channel ChannelNo="13" Name="CMYSpeed" Semantic="CMY + CTO Speed" Category="Control"/>
		<Channel ChannelNo="14" Name="Gobo1" Semantic="Static Gobo Whell" Category="Beam" HighlightValue="0"/>
		<Channel ChannelNo="15" Name="Gobo2" Semantic="Rotating Gobo Wheel" Category="Beam" HighlightValue="0"/>
		<Channel ChannelNo="16" Name="Gobo2Pos" Semantic="Gobo Indexing" Category="Beam"/>
		<Channel ChannelNo="17" Name="Prism1" Semantic="Prism" Category="Beam" HighlightValue="0"/>
		<Channel ChannelNo="18" Name="Prism1Rot" Semantic="Prism Rotation" Category="Beam"/>
		<Channel ChannelNo="19" Name="Frost1" Semantic="Frost" Category="Beam" HighlightValue="0"/>
		<Channel ChannelNo="20" Name="Iris" Semantic="Iris" Category="Beam" HighlightValue="0"/>
		<Channel ChannelNo="21" Name="Focus" Semantic="Focus" Category="Beam"/>
		<Channel ChannelNo="22" Name="Shutter" Semantic="Shutter" Category="Beam" DefaultValue="255" HighlightValue="255"/>
		<Channel ChannelNo="23" Name="Intensity1" Semantic="Dimmer" Category="Intensity" HighlightValue="255"/>
	</ChannelDefinition>
	<DependencyDeclaration>
		
		
		
		
		
		
		
		
		
	</DependencyDeclaration>
	<ParameterDefinition>
		
		
		
		
		
		
		
		
		
		
		
		
		
		

		
		

		
		
		
		
		
	</ParameterDefinition>
</DeviceDescription>
