<?xml version="1.0" encoding="UTF-8"?>
<DeviceDescription xmlns="../ns_description" xmlns:xsi="http://www.w3.org/2001/XMLSchema-instance" xsi:schemaLocation="../ns_description
	../../../device_description.xsd">
	<ManufacturerInfo Manufacturer="Martin" Model="Roboscan pro 518" Firmware=""/>
	<PhysicalProperties Type="Mirror">
		<Weight>
			<Unit>kg</Unit>
			<Value>14</Value>
		</Weight>
		<Geometry>
			<Width>
				<Unit>mm</Unit>
				<Value>280</Value>
			</Width>
			<Depth>
				<Unit>mm</Unit>
				<Value>185</Value>
			</Depth>
			<Height>
				<Unit>mm</Unit>
				<Value>533</Value>
			</Height>
		</Geometry>
		<Lamp>
			<Type>MSD</Type>
			<Model>philips MSD 250/2</Model>
			<Power>250</Power>
			<ColorTemp>8500</ColorTemp>
		</Lamp>
	</PhysicalProperties>
	<ChannelDefinition Align="9">
		<Channel ChannelNo="1" Name="Shutter" Semantic="Shutter" Category="Beam" DefaultValue="0"/>
		<Channel ChannelNo="2" Name="Intensity1" Semantic="Dimmer" Category="Intensity" DefaultValue="255"/>
		<Channel ChannelNo="3" Name="Colour1" Semantic="Colour1" Category="Colour" DefaultValue="0"/>
		<Channel ChannelNo="4" Name="Gobo1" Semantic="Gobo" Category="Beam" DefaultValue="0"/>
		<Channel ChannelNo="5" Name="Effect1" Semantic="Effect" Category="Beam" DefaultValue="0"/>
		<Channel ChannelNo="6" Name="Pan" Semantic="Pan Coarse" Category="Position" BitRes="16" DefaultValue="128" ByteNo="1"/>
		<Channel ChannelNo="7" Name="PanFine" Semantic="Pan Fine" Category="Position" BitRes="16" DefaultValue="0" ByteNo="0" MasterChannelNo="6"/>
		<Channel ChannelNo="8" Name="Tilt" Semantic="Tilt Coarse" Category="Position" BitRes="16" DefaultValue="128" ByteNo="1"/>
		<Channel ChannelNo="9" Name="TiltFine" Semantic="Tilt Fine" Category="Position" BitRes="16" DefaultValue="0" ByteNo="0" MasterChannelNo="8"/>
	</ChannelDefinition>
	<DependencyDeclaration/>
	<ParameterDefinition/>
</DeviceDescription>
