<?xml version="1.0" encoding="UTF-8"?>
<DeviceDescription xmlns="../ns_description" xmlns:xsi="http://www.w3.org/2001/XMLSchema-instance" xsi:schemaLocation="../ns_description
	../../../device_description.xsd">
	<ManufacturerInfo Manufacturer="Martin" Model="Mac Aura" Firmware="Rev.A" Mode="Standard"/>
	<PhysicalProperties Type="YokeWash">
		<Weight>
			<Unit>kg</Unit>
			<Value>5.6</Value>
		</Weight>
		<Geometry>
			<Width>
				<Unit>mm</Unit>
				<Value>302</Value>
			</Width>
			<Depth>
				<Unit>mm</Unit>
				<Value>302</Value>
			</Depth>
			<Height>
				<Unit>mm</Unit>
				<Value>360</Value>
			</Height>
		</Geometry>
		<Lamp>
			<Type>LED</Type>
			<Model>33x RGBW LED mutichips</Model>
		</Lamp>
	</PhysicalProperties>
	<ChannelDefinition Align="14">
		<Channel ChannelNo="1" Name="Shutter" Semantic="Shutter / Strobe" Category="Beam"/>
		<Channel ChannelNo="2" Name="Intensity1" Semantic="Dimmer" Category="Intensity" HighlightValue="255"/>
		<Channel ChannelNo="3" Name="Zoom" Semantic="Zoom" Category="Beam"/>
		<Channel ChannelNo="4" Name="Pan" Semantic="Pan" Category="Position" BitRes="16" ByteNo="1" DefaultValue="128"/>
		<Channel ChannelNo="5" Name="PanFine" Semantic="Pan Fine" Category="Position" BitRes="16" ByteNo="0" MasterChannelNo="4" DefaultValue="128"/>
		<Channel ChannelNo="6" Name="Tilt" Semantic="Tilt" Category="Position" BitRes="16" ByteNo="1" DefaultValue="128"/>
		<Channel ChannelNo="7" Name="TiltFine" Semantic="Tilt Fine" Category="Position" BitRes="16" ByteNo="0" MasterChannelNo="6" DefaultValue="128"/>
		<Channel ChannelNo="8" Name="Control" Semantic="Control" Category="Control" DefaultValue="0"/>
		<Channel ChannelNo="9" Name="Colour1" Semantic="Colour" Category="Colour" DefaultValue="0" HighlightValue="0"/>
		<Channel ChannelNo="10" Name="Red" Semantic="Red" Category="Colour"/>
		<Channel ChannelNo="11" Name="Green" Semantic="Green" Category="Colour"/>
		<Channel ChannelNo="12" Name="Blue" Semantic="Blue" Category="Colour"/>
		<Channel ChannelNo="13" Name="White" Semantic="White" Category="Colour"/>
		<Channel ChannelNo="14" Name="CTO" Semantic="CTC" Category="Colour" HighlightValue="0"/>
	</ChannelDefinition>
	<DependencyDeclaration/>
	<ParameterDefinition/>
</DeviceDescription>
