<?xml version="1.0" encoding="UTF-8"?>
<DeviceDescription xmlns="../ns_description" xmlns:xsi="http://www.w3.org/2001/XMLSchema-instance" xsi:schemaLocation="../ns_description
	../../../device_description.xsd">
	<ManufacturerInfo Manufacturer="Martin" Model="Pal 1200" Firmware=""/>
	<PhysicalProperties Type="Mirror">
		<Weight>
			<Unit>kg</Unit>
			<Value>61</Value>
		</Weight>
		<Geometry>
			<Width>
				<Unit>mm</Unit>
				<Value>436</Value>
			</Width>
			<Depth>
				<Unit>mm</Unit>
				<Value>372</Value>
			</Depth>
			<Height>
				<Unit>mm</Unit>
				<Value>1331</Value>
			</Height>
		</Geometry>
		<Lamp>
			<Type>MSR</Type>
			<Model>philips MSR 1200W</Model>
			<Power>1200</Power>
			<ColorTemp>6000</ColorTemp>
		</Lamp>
	</PhysicalProperties>
	<ChannelDefinition Align="26">
		<Channel ChannelNo="1" Name="LampCTRL" Semantic="LampCTRL" Category="Control" DefaultValue="0"/>
		<Channel ChannelNo="2" Name="Intensity1" Semantic="Dimmer" Category="Intensity" DefaultValue="255"/>
		<Channel ChannelNo="3" Name="Framing1a" Semantic="Framing1a" Category="Beam" DefaultValue="0"/>
		<Channel ChannelNo="4" Name="Framing1b" Semantic="Framing1b" Category="Beam" DefaultValue="0"/>
		<Channel ChannelNo="5" Name="Framing2a" Semantic="Framing2a" Category="Beam" DefaultValue="0"/>
		<Channel ChannelNo="6" Name="Framing2b" Semantic="Framing2b" Category="Beam" DefaultValue="0"/>
		<Channel ChannelNo="7" Name="Framing3a" Semantic="Framing3a" Category="Beam" DefaultValue="0"/>
		<Channel ChannelNo="8" Name="Framing3b" Semantic="Framing3b" Category="Beam" DefaultValue="0"/>
		<Channel ChannelNo="9" Name="Framing4a" Semantic="Framing4a" Category="Beam" DefaultValue="0"/>
		<Channel ChannelNo="10" Name="Framing4b" Semantic="Framing4b" Category="Beam" DefaultValue="0"/>
		<Channel ChannelNo="11" Name="FramingRot" Semantic="Framing Rot" Category="Beam" DefaultValue="128"/>
		<Channel ChannelNo="12" Name="Cyan" Semantic="Cyan" Category="Colour" DefaultValue="0"/>
		<Channel ChannelNo="13" Name="Magenta" Semantic="Magenta" Category="Colour" DefaultValue="0"/>
		<Channel ChannelNo="14" Name="Yellow" Semantic="Yellow" Category="Colour" DefaultValue="0"/>
		<Channel ChannelNo="15" Name="Colour1" Semantic="Colour" Category="Colour" DefaultValue="0"/>
		<Channel ChannelNo="16" Name="Gobo1" Semantic="Gobo" Category="Beam" DefaultValue="0"/>
		<Channel ChannelNo="17" Name="Gobo1Rot" Semantic="Gobo Rot" Category="Beam" DefaultValue="0"/>
		<Channel ChannelNo="18" Name="Focus" Semantic="Focus" Category="Beam" DefaultValue="0"/>
		<Channel ChannelNo="19" Name="Zoom" Semantic="Zoom" Category="Beam" DefaultValue="0"/>
		<Channel ChannelNo="20" Name="Frost" Semantic="Frost" Category="Beam" DefaultValue="0"/>
		<Channel ChannelNo="21" Name="Pan" Semantic="Pan Coarse" Category="Position" BitRes="16" DefaultValue="128" ByteNo="1"/>
		<Channel ChannelNo="22" Name="PanFine" Semantic="Pan Fine" Category="Position" BitRes="16" DefaultValue="0" ByteNo="0" MasterChannelNo="21"/>
		<Channel ChannelNo="23" Name="Tilt" Semantic="Tilt Coarse" Category="Position" BitRes="16" DefaultValue="128" ByteNo="1"/>
		<Channel ChannelNo="24" Name="TiltFine" Semantic="Tilt Fine" Category="Position" BitRes="16" DefaultValue="0" ByteNo="0" MasterChannelNo="23"/>
		<Channel ChannelNo="25" Name="PanTiltSpeed" Semantic="Pan Tilt Speed" Category="Control" DefaultValue="0"/>
		<Channel ChannelNo="26" Name="MSpeed" Semantic="MSpeed" Category="Control" DefaultValue="0"/>
	</ChannelDefinition>
	<DependencyDeclaration/>
	<ParameterDefinition/>
</DeviceDescription>
