<?xml version="1.0" encoding="UTF-8"?>
<!-- edited with XMLSpy v2010 (http://www.altova.com) by test (test) -->
<DeviceDescription xmlns="../ns_description" xmlns:xsi="http://www.w3.org/2001/XMLSchema-instance" xsi:schemaLocation="../ns_description
	../../../device_description.xsd">
	<ManufacturerInfo Manufacturer="Robe" Model="Robin CycFX8" Firmware="" Mode="3"/>
	<PhysicalProperties Type="Control">
		<Weight>
			<Unit>kg</Unit>
			<Value>12</Value>
		</Weight>
		<Geometry>
			<Width>
				<Unit>mm</Unit>
				<Value>999</Value>
			</Width>
			<Depth>
				<Unit>mm</Unit>
				<Value>180</Value>
			</Depth>
			<Height>
				<Unit>mm</Unit>
				<Value>228</Value>
			</Height>
		</Geometry>
		<Lamp>
			<Type>LED</Type>
			<Model>8 x 15W RGBW</Model>
		</Lamp>
	</PhysicalProperties>
	<ChannelDefinition Align="21">
		<Channel ChannelNo="1" Name="Tilt" Semantic="Tilt" Category="Position" BitRes="16" ByteNo="1" DefaultValue="128"/>
		<Channel ChannelNo="2" Name="TiltFine" Semantic="Tilt Fine" Category="Position" BitRes="16" ByteNo="0" MasterChannelNo="1" DefaultValue="128"/>
		<Channel ChannelNo="3" Name="PanTiltSpeed" Semantic="TiltSpeed" Category="Control" DefaultValue="0"/>
		<Channel ChannelNo="4" Name="Control" Semantic="Special Functions" Category="Control" DefaultValue="0"/>
		<Channel ChannelNo="5" Name="Red" Semantic="Red Coarse" Category="Colour" BitRes="16" ByteNo="1" DefaultValue="0" HighlightValue="255"/>
		<Channel ChannelNo="6" Name="RedFine" Semantic="Red Fine" Category="Colour" BitRes="16" ByteNo="0" MasterChannelNo="5" DefaultValue="0" HighlightValue="255"/>
		<Channel ChannelNo="7" Name="Green" Semantic="Green Coarse" Category="Colour" BitRes="16" ByteNo="1" DefaultValue="0" HighlightValue="255"/>
		<Channel ChannelNo="8" Name="GreenFine" Semantic="Green Fine" Category="Colour" BitRes="16" ByteNo="0" MasterChannelNo="7" DefaultValue="0" HighlightValue="255"/>
		<Channel ChannelNo="9" Name="Blue" Semantic="Blue Coarse" Category="Colour" BitRes="16" ByteNo="1" HighlightValue="255"/>
		<Channel ChannelNo="10" Name="BlueFine" Semantic="Blue Fine" Category="Colour" BitRes="16" ByteNo="0" MasterChannelNo="9" HighlightValue="255" DefaultValue="0"/>
		<Channel ChannelNo="11" Name="White" Semantic="White Coarse" Category="Colour" BitRes="16" ByteNo="1" HighlightValue="255"/>
		<Channel ChannelNo="12" Name="WhiteFine" Semantic="White Fine" Category="Colour" BitRes="16" ByteNo="0" MasterChannelNo="11" DefaultValue="0" HighlightValue="255"/>
		<Channel ChannelNo="13" Name="CTO" Semantic="CTO" Category="Colour"/>
		<Channel ChannelNo="14" Name="MacroColour" Semantic="Virtual Color Wheel" Category="Colour"/>
		<Channel ChannelNo="15" Name="Effect1" Semantic="Pixel Effect" Category="Colour"/>
		<Channel ChannelNo="16" Name="Effect1Speed" Semantic="Pixel Effect Speed" Category="Colour"/>
		<Channel ChannelNo="17" Name="Zoom" Semantic="Zoom" Category="Beam" BitRes="16" ByteNo="1"/>
		<Channel ChannelNo="18" Name="ZoomFine" Semantic="Zoom Fine" Category="Beam" BitRes="16" ByteNo="0" MasterChannelNo="17"/>
		<Channel ChannelNo="19" Name="Shutter" Semantic="Shutter" Category="Beam" DefaultValue="255" HighlightValue="255"/>
		<Channel ChannelNo="20" Name="Intensity1" Semantic="Dimmer Coarse" Category="Intensity" BitRes="16" ByteNo="1" HighlightValue="255"/>
		<Channel ChannelNo="21" Name="Intensity1Fine" Semantic="Dimmer Fine" Category="Intensity" BitRes="16" ByteNo="0" MasterChannelNo="20" HighlightValue="255"/>
		
	</ChannelDefinition>
	<DependencyDeclaration/>
	<ParameterDefinition/>
</DeviceDescription>
