<?xml version="1.0" encoding="UTF-8"?>
<DeviceDescription xmlns="../ns_description" xmlns:xsi="http://www.w3.org/2001/XMLSchema-instance" xsi:schemaLocation="../ns_description
	../../../device_description.xsd">
	<ManufacturerInfo Manufacturer="Martin" Model="Fibersource qfx 150" Firmware=""/>
	<PhysicalProperties Type="Effect">
		<Weight>
			<Unit>kg</Unit>
			<Value>10.4</Value>
		</Weight>
		<Geometry>
			<Width>
				<Unit>mm</Unit>
				<Value>213</Value>
			</Width>
			<Depth>
				<Unit>mm</Unit>
				<Value>199</Value>
			</Depth>
			<Height>
				<Unit>mm</Unit>
				<Value>330</Value>
			</Height>
		</Geometry>
		<Lamp>
			<Type>HQI-R</Type>
			<Model>Osram HQR-R 150</Model>
			<Power>150</Power>
			<ColorTemp>4200</ColorTemp>
		</Lamp>
	</PhysicalProperties>
	<ChannelDefinition Align="5">
		<Channel ChannelNo="1" Name="LampCTRL" Semantic="LampCTRL" Category="Control" DefaultValue="0"/>
		<Channel ChannelNo="2" Name="Intensity1" Semantic="Dimmer" Category="Intensity" DefaultValue="255"/>
		<Channel ChannelNo="3" Name="Colour1" Semantic="Colour" Category="Colour" DefaultValue="0"/>
		<Channel ChannelNo="4" Name="Effect1" Semantic="Effect" Category="Beam" DefaultValue="0"/>
		<Channel ChannelNo="5" Name="Colour1Speed" Semantic="Colour Speed" Category="Control" DefaultValue="0"/>
	</ChannelDefinition>
	<DependencyDeclaration/>
	<ParameterDefinition/>
</DeviceDescription>
